{"apiVersion":"bugate.io/v2","description":"Proposed additional scenario S-security","digest":"sha256:28ddc000fac27f75551ebd5a07eecb293a5e373a84f264b7209abbc30ebf8995","id":"extension-eb9b0485a8245519aa8cc8f97405b06c","kind":"Suggestion","rationale":"No required scenario in the current scope. Proposed executable details were not admitted.","scope_ref":{"digest":"sha256:9717b7810ea98fdc5f5bbf7e0f38e6e715ee5c7f981fc9e835e2a8af8c82cd88","id":"acceptance","revision":1},"source_refs":["SRC1"],"status":"suggested","task_id":"same-task","workspace_id":"sha256:cdfdb32e721f3faffef5ba403eebe28f0a19a1fb81d2b00dd530e8962c65c9e2"}
