{"apiVersion":"bugate.io/v2","description":"Possible separate performance review","digest":"sha256:d4aec6753089fcb31773174d491b3567e121839cce2480d79fbd4f0de9daa9ac","id":"performance-suggestion","kind":"Suggestion","rationale":"Not required by the finite current user objective","scope_ref":{"digest":"sha256:9717b7810ea98fdc5f5bbf7e0f38e6e715ee5c7f981fc9e835e2a8af8c82cd88","id":"acceptance","revision":1},"source_refs":["SRC1"],"status":"suggested","task_id":"same-task","workspace_id":"sha256:cdfdb32e721f3faffef5ba403eebe28f0a19a1fb81d2b00dd530e8962c65c9e2"}
