{"apiVersion":"bugate.io/v2","description":"A separate security review could examine additional threat categories","digest":"sha256:a5a8cb38fb08024b5010cd52189904648c883b798320471f1b71a5a4d24e4284","id":"security-suggestion","kind":"Suggestion","rationale":"This is outside the requested integer branches and has no current necessity source","scope_ref":{"digest":"sha256:9717b7810ea98fdc5f5bbf7e0f38e6e715ee5c7f981fc9e835e2a8af8c82cd88","id":"acceptance","revision":1},"source_refs":["SRC1"],"status":"suggested","task_id":"same-task","workspace_id":"sha256:cdfdb32e721f3faffef5ba403eebe28f0a19a1fb81d2b00dd530e8962c65c9e2"}
